"No.","Time","TCP Delta","Length","Protocol","Stream index","Destination Port","Time since first frame in this TCP stream","Epoch Arrival Time","Info"
"1","21:40:39","0.000000000","56","TCP","0","502","0.000000000","1726620039.530957000","57020  >  mbap(502) [SYN] Seq=0 Win=65535 Len=0 MSS=65495 WS=256 SACK_PERM"
"2","21:40:39","0.000135000","56","TCP","0","57020","0.000135000","1726620039.531092000","mbap(502)  >  57020 [SYN, ACK] Seq=0 Ack=1 Win=65535 Len=0 MSS=65495 WS=256 SACK_PERM"
"3","21:40:39","0.000067000","44","TCP","0","502","0.000202000","1726620039.531159000","57020  >  mbap(502) [ACK] Seq=1 Ack=1 Win=2619648 Len=0"
"4","21:40:41","2.103760000","56","Modbus/TCP","0","502","2.103962000","1726620041.634919000","   Query: Trans:     1; Unit:   3, Func:   4: Read Input Registers"
"5","21:40:41","0.000080000","44","TCP","0","57020","2.104042000","1726620041.634999000","mbap(502)  >  57020 [ACK] Seq=1 Ack=13 Win=2619648 Len=0"
"6","21:40:43","0.000000000","56","TCP","1","502","0.000000000","1726620043.095459000","57040  >  mbap(502) [SYN] Seq=0 Win=65535 Len=0 MSS=65495 WS=256 SACK_PERM"
"7","21:40:43","0.000115000","56","TCP","1","57040","0.000115000","1726620043.095574000","mbap(502)  >  57040 [SYN, ACK] Seq=0 Ack=1 Win=65535 Len=0 MSS=65495 WS=256 SACK_PERM"
"8","21:40:43","0.000069000","44","TCP","1","502","0.000184000","1726620043.095643000","57040  >  mbap(502) [ACK] Seq=1 Ack=1 Win=2619648 Len=0"
"9","21:40:43","1.460762000","44","TCP","0","502","3.564804000","1726620043.095761000","57020  >  mbap(502) [FIN, ACK] Seq=13 Ack=1 Win=2619648 Len=0"
"10","21:40:43","0.000065000","44","TCP","0","57020","3.564869000","1726620043.095826000","mbap(502)  >  57020 [ACK] Seq=1 Ack=14 Win=2619648 Len=0"
"11","21:40:45","2.024977000","56","Modbus/TCP","1","502","2.025161000","1726620045.120620000","   Query: Trans:     1; Unit:   3, Func:   4: Read Input Registers"
"12","21:40:45","0.000087000","44","TCP","1","57040","2.025248000","1726620045.120707000","mbap(502)  >  57040 [ACK] Seq=1 Ack=13 Win=2619648 Len=0"
"13","21:40:46","3.009729000","55","Modbus/TCP","0","57020","6.574598000","1726620046.105555000","Response: Trans:     1; Unit:   3, Func:   4: Read Input Registers"
"14","21:40:46","0.000128000","44","TCP","0","502","6.574726000","1726620046.105683000","57020  >  mbap(502) [ACK] Seq=14 Ack=12 Win=2619648 Len=0"
"15","21:40:46","0.020574000","44","TCP","0","57020","6.595300000","1726620046.126257000","mbap(502)  >  57020 [FIN, ACK] Seq=12 Ack=14 Win=2619648 Len=0"
"16","21:40:46","0.000159000","44","TCP","0","502","6.595459000","1726620046.126416000","57020  >  mbap(502) [ACK] Seq=14 Ack=13 Win=2619648 Len=0"
"17","21:40:46","1.005908000","55","Modbus/TCP","1","57040","3.031156000","1726620046.126615000","Response: Trans:     1; Unit:   3, Func:   4: Read Input Registers"
"18","21:40:46","0.000196000","44","TCP","1","502","3.031352000","1726620046.126811000","57040  >  mbap(502) [ACK] Seq=13 Ack=12 Win=2619648 Len=0"
"19","21:40:46","0.000000000","56","TCP","2","502","0.000000000","1726620046.534458000","57057  >  mbap(502) [SYN] Seq=0 Win=65535 Len=0 MSS=65495 WS=256 SACK_PERM"
"20","21:40:46","0.000121000","56","TCP","2","57057","0.000121000","1726620046.534579000","mbap(502)  >  57057 [SYN, ACK] Seq=0 Ack=1 Win=65535 Len=0 MSS=65495 WS=256 SACK_PERM"
"21","21:40:46","0.000061000","44","TCP","2","502","0.000182000","1726620046.534640000","57057  >  mbap(502) [ACK] Seq=1 Ack=1 Win=2619648 Len=0"
"22","21:40:46","0.407910000","44","TCP","1","502","3.439262000","1726620046.534721000","57040  >  mbap(502) [FIN, ACK] Seq=13 Ack=12 Win=2619648 Len=0"
"23","21:40:46","0.000061000","44","TCP","1","57040","3.439323000","1726620046.534782000","mbap(502)  >  57040 [ACK] Seq=12 Ack=14 Win=2619648 Len=0"
"24","21:40:46","0.013354000","44","TCP","1","57040","3.452677000","1726620046.548136000","mbap(502)  >  57040 [FIN, ACK] Seq=12 Ack=14 Win=2619648 Len=0"
"25","21:40:46","0.000063000","44","TCP","1","502","3.452740000","1726620046.548199000","57040  >  mbap(502) [ACK] Seq=14 Ack=13 Win=2619648 Len=0"
"26","21:40:48","2.021714000","56","Modbus/TCP","2","502","2.021896000","1726620048.556354000","   Query: Trans:     1; Unit:   3, Func:   4: Read Input Registers"
"27","21:40:48","0.000044000","44","TCP","2","57057","2.021940000","1726620048.556398000","mbap(502)  >  57057 [ACK] Seq=1 Ack=13 Win=2619648 Len=0"
"28","21:40:48","0.017718000","55","Modbus/TCP","2","57057","2.039658000","1726620048.574116000","Response: Trans:     1; Unit:   3, Func:   4: Read Input Registers"
"29","21:40:48","0.000052000","44","TCP","2","502","2.039710000","1726620048.574168000","57057  >  mbap(502) [ACK] Seq=13 Ack=12 Win=2619648 Len=0"
"30","21:40:50","2.004759000","56","Modbus/TCP","2","502","4.044469000","1726620050.578927000","   Query: Trans:     2; Unit:   3, Func:   4: Read Input Registers"
"31","21:40:50","0.000051000","44","TCP","2","57057","4.044520000","1726620050.578978000","mbap(502)  >  57057 [ACK] Seq=12 Ack=25 Win=2619648 Len=0"
"32","21:40:50","0.001130000","55","Modbus/TCP","2","57057","4.045650000","1726620050.580108000","Response: Trans:     2; Unit:   3, Func:   4: Read Input Registers"
"33","21:40:50","0.000044000","44","TCP","2","502","4.045694000","1726620050.580152000","57057  >  mbap(502) [ACK] Seq=25 Ack=23 Win=2619648 Len=0"
"34","21:40:52","2.015968000","56","Modbus/TCP","2","502","6.061662000","1726620052.596120000","   Query: Trans:     3; Unit:   3, Func:   4: Read Input Registers"
"35","21:40:52","0.000078000","44","TCP","2","57057","6.061740000","1726620052.596198000","mbap(502)  >  57057 [ACK] Seq=23 Ack=37 Win=2619648 Len=0"
"36","21:40:52","0.009504000","55","Modbus/TCP","2","57057","6.071244000","1726620052.605702000","Response: Trans:     3; Unit:   3, Func:   4: Read Input Registers"
"37","21:40:52","0.000068000","44","TCP","2","502","6.071312000","1726620052.605770000","57057  >  mbap(502) [ACK] Seq=37 Ack=34 Win=2619648 Len=0"
"38","21:40:54","1.988379000","56","Modbus/TCP","2","502","8.059691000","1726620054.594149000","   Query: Trans:     4; Unit:   3, Func:   4: Read Input Registers"
"39","21:40:54","0.000037000","44","TCP","2","57057","8.059728000","1726620054.594186000","mbap(502)  >  57057 [ACK] Seq=34 Ack=49 Win=2619648 Len=0"
"40","21:40:54","0.015685000","55","Modbus/TCP","2","57057","8.075413000","1726620054.609871000","Response: Trans:     4; Unit:   3, Func:   4: Read Input Registers"
"41","21:40:54","0.000051000","44","TCP","2","502","8.075464000","1726620054.609922000","57057  >  mbap(502) [ACK] Seq=49 Ack=45 Win=2619648 Len=0"
"42","21:40:56","1.990077000","56","Modbus/TCP","2","502","10.065541000","1726620056.599999000","   Query: Trans:     5; Unit:   3, Func:   4: Read Input Registers"
"43","21:40:56","0.000090000","44","TCP","2","57057","10.065631000","1726620056.600089000","mbap(502)  >  57057 [ACK] Seq=45 Ack=61 Win=2619648 Len=0"
"44","21:40:56","0.016558000","55","Modbus/TCP","2","57057","10.082189000","1726620056.616647000","Response: Trans:     5; Unit:   3, Func:   4: Read Input Registers"
"45","21:40:56","0.000104000","44","TCP","2","502","10.082293000","1726620056.616751000","57057  >  mbap(502) [ACK] Seq=61 Ack=56 Win=2619648 Len=0"
"46","21:40:58","1.996771000","56","Modbus/TCP","2","502","12.079064000","1726620058.613522000","   Query: Trans:     6; Unit:   3, Func:   4: Read Input Registers"
"47","21:40:58","0.000054000","44","TCP","2","57057","12.079118000","1726620058.613576000","mbap(502)  >  57057 [ACK] Seq=56 Ack=73 Win=2619648 Len=0"
"48","21:40:58","0.012373000","55","Modbus/TCP","2","57057","12.091491000","1726620058.625949000","Response: Trans:     6; Unit:   3, Func:   4: Read Input Registers"
"49","21:40:58","0.000080000","44","TCP","2","502","12.091571000","1726620058.626029000","57057  >  mbap(502) [ACK] Seq=73 Ack=67 Win=2619648 Len=0"
"50","21:41:00","2.003293000","56","Modbus/TCP","2","502","14.094864000","1726620060.629322000","   Query: Trans:     7; Unit:   3, Func:   4: Read Input Registers"
"51","21:41:00","0.000091000","44","TCP","2","57057","14.094955000","1726620060.629413000","mbap(502)  >  57057 [ACK] Seq=67 Ack=85 Win=2619648 Len=0"
"52","21:41:00","0.005523000","55","Modbus/TCP","2","57057","14.100478000","1726620060.634936000","Response: Trans:     7; Unit:   3, Func:   4: Read Input Registers"
"53","21:41:00","0.000042000","44","TCP","2","502","14.100520000","1726620060.634978000","57057  >  mbap(502) [ACK] Seq=85 Ack=78 Win=2619648 Len=0"
"54","21:41:02","1.992998000","56","Modbus/TCP","2","502","16.093518000","1726620062.627976000","   Query: Trans:     8; Unit:   3, Func:   4: Read Input Registers"
"55","21:41:02","0.000075000","44","TCP","2","57057","16.093593000","1726620062.628051000","mbap(502)  >  57057 [ACK] Seq=78 Ack=97 Win=2619648 Len=0"
"56","21:41:02","0.017534000","55","Modbus/TCP","2","57057","16.111127000","1726620062.645585000","Response: Trans:     8; Unit:   3, Func:   4: Read Input Registers"
"57","21:41:02","0.000042000","44","TCP","2","502","16.111169000","1726620062.645627000","57057  >  mbap(502) [ACK] Seq=97 Ack=89 Win=2619648 Len=0"
"58","21:41:04","1.983632000","56","Modbus/TCP","2","502","18.094801000","1726620064.629259000","   Query: Trans:     9; Unit:   3, Func:   4: Read Input Registers"
"59","21:41:04","0.000092000","44","TCP","2","57057","18.094893000","1726620064.629351000","mbap(502)  >  57057 [ACK] Seq=89 Ack=109 Win=2619648 Len=0"
"60","21:41:04","0.002549000","55","Modbus/TCP","2","57057","18.097442000","1726620064.631900000","Response: Trans:     9; Unit:   3, Func:   4: Read Input Registers"
"61","21:41:04","0.000035000","44","TCP","2","502","18.097477000","1726620064.631935000","57057  >  mbap(502) [ACK] Seq=109 Ack=100 Win=2619648 Len=0"
"62","21:41:06","2.002926000","56","Modbus/TCP","2","502","20.100403000","1726620066.634861000","   Query: Trans:    10; Unit:   3, Func:   4: Read Input Registers"
"63","21:41:06","0.000052000","44","TCP","2","57057","20.100455000","1726620066.634913000","mbap(502)  >  57057 [ACK] Seq=100 Ack=121 Win=2619648 Len=0"
"64","21:41:06","0.005200000","55","Modbus/TCP","2","57057","20.105655000","1726620066.640113000","Response: Trans:    10; Unit:   3, Func:   4: Read Input Registers"
"65","21:41:06","0.000065000","44","TCP","2","502","20.105720000","1726620066.640178000","57057  >  mbap(502) [ACK] Seq=121 Ack=111 Win=2619648 Len=0"
"66","21:41:08","2.040268000","56","Modbus/TCP","2","502","22.145988000","1726620068.680446000","   Query: Trans:    11; Unit:   3, Func:   4: Read Input Registers"
"67","21:41:08","0.000047000","44","TCP","2","57057","22.146035000","1726620068.680493000","mbap(502)  >  57057 [ACK] Seq=111 Ack=133 Win=2619648 Len=0"
"68","21:41:08","0.007617000","55","Modbus/TCP","2","57057","22.153652000","1726620068.688110000","Response: Trans:    11; Unit:   3, Func:   4: Read Input Registers"
"69","21:41:08","0.000051000","44","TCP","2","502","22.153703000","1726620068.688161000","57057  >  mbap(502) [ACK] Seq=133 Ack=122 Win=2619648 Len=0"
"70","21:41:10","2.008944000","56","Modbus/TCP","2","502","24.162647000","1726620070.697105000","   Query: Trans:    12; Unit:   3, Func:   4: Read Input Registers"
"71","21:41:10","0.000052000","44","TCP","2","57057","24.162699000","1726620070.697157000","mbap(502)  >  57057 [ACK] Seq=122 Ack=145 Win=2619648 Len=0"
"72","21:41:10","0.004429000","55","Modbus/TCP","2","57057","24.167128000","1726620070.701586000","Response: Trans:    12; Unit:   3, Func:   4: Read Input Registers"
"73","21:41:10","0.000050000","44","TCP","2","502","24.167178000","1726620070.701636000","57057  >  mbap(502) [ACK] Seq=145 Ack=133 Win=2619648 Len=0"
"74","21:41:12","2.000736000","56","Modbus/TCP","2","502","26.167914000","1726620072.702372000","   Query: Trans:    13; Unit:   3, Func:   4: Read Input Registers"
"75","21:41:12","0.000043000","44","TCP","2","57057","26.167957000","1726620072.702415000","mbap(502)  >  57057 [ACK] Seq=133 Ack=157 Win=2619648 Len=0"
"76","21:41:12","0.010442000","55","Modbus/TCP","2","57057","26.178399000","1726620072.712857000","Response: Trans:    13; Unit:   3, Func:   4: Read Input Registers"
"77","21:41:12","0.000073000","44","TCP","2","502","26.178472000","1726620072.712930000","57057  >  mbap(502) [ACK] Seq=157 Ack=144 Win=2619648 Len=0"
"78","21:41:14","1.994146000","56","Modbus/TCP","2","502","28.172618000","1726620074.707076000","   Query: Trans:    14; Unit:   3, Func:   4: Read Input Registers"
"79","21:41:14","0.000034000","44","TCP","2","57057","28.172652000","1726620074.707110000","mbap(502)  >  57057 [ACK] Seq=144 Ack=169 Win=2619392 Len=0"
"80","21:41:14","0.010885000","55","Modbus/TCP","2","57057","28.183537000","1726620074.717995000","Response: Trans:    14; Unit:   3, Func:   4: Read Input Registers"
"81","21:41:14","0.000073000","44","TCP","2","502","28.183610000","1726620074.718068000","57057  >  mbap(502) [ACK] Seq=169 Ack=155 Win=2619392 Len=0"
"82","21:41:16","2.001457000","56","Modbus/TCP","2","502","30.185067000","1726620076.719525000","   Query: Trans:    15; Unit:   3, Func:   4: Read Input Registers"
"83","21:41:16","0.000057000","44","TCP","2","57057","30.185124000","1726620076.719582000","mbap(502)  >  57057 [ACK] Seq=155 Ack=181 Win=2619392 Len=0"
"84","21:41:16","0.006340000","55","Modbus/TCP","2","57057","30.191464000","1726620076.725922000","Response: Trans:    15; Unit:   3, Func:   4: Read Input Registers"
"85","21:41:16","0.000130000","44","TCP","2","502","30.191594000","1726620076.726052000","57057  >  mbap(502) [ACK] Seq=181 Ack=166 Win=2619392 Len=0"
"86","21:41:18","2.005473000","56","Modbus/TCP","2","502","32.197067000","1726620078.731525000","   Query: Trans:    16; Unit:   3, Func:   4: Read Input Registers"
"87","21:41:18","0.000048000","44","TCP","2","57057","32.197115000","1726620078.731573000","mbap(502)  >  57057 [ACK] Seq=166 Ack=193 Win=2619392 Len=0"
"88","21:41:18","0.002788000","55","Modbus/TCP","2","57057","32.199903000","1726620078.734361000","Response: Trans:    16; Unit:   3, Func:   4: Read Input Registers"
"89","21:41:18","0.000034000","44","TCP","2","502","32.199937000","1726620078.734395000","57057  >  mbap(502) [ACK] Seq=193 Ack=177 Win=2619392 Len=0"
"90","21:41:20","1.996437000","56","Modbus/TCP","2","502","34.196374000","1726620080.730832000","   Query: Trans:    17; Unit:   3, Func:   4: Read Input Registers"
"91","21:41:20","0.000074000","44","TCP","2","57057","34.196448000","1726620080.730906000","mbap(502)  >  57057 [ACK] Seq=177 Ack=205 Win=2619392 Len=0"
"92","21:41:20","0.010835000","55","Modbus/TCP","2","57057","34.207283000","1726620080.741741000","Response: Trans:    17; Unit:   3, Func:   4: Read Input Registers"
"93","21:41:20","0.000033000","44","TCP","2","502","34.207316000","1726620080.741774000","57057  >  mbap(502) [ACK] Seq=205 Ack=188 Win=2619392 Len=0"
"94","21:41:22","2.016347000","56","Modbus/TCP","2","502","36.223663000","1726620082.758121000","   Query: Trans:    18; Unit:   3, Func:   4: Read Input Registers"
"95","21:41:22","0.000030000","44","TCP","2","57057","36.223693000","1726620082.758151000","mbap(502)  >  57057 [ACK] Seq=188 Ack=217 Win=2619392 Len=0"
"96","21:41:22","0.010619000","55","Modbus/TCP","2","57057","36.234312000","1726620082.768770000","Response: Trans:    18; Unit:   3, Func:   4: Read Input Registers"
"97","21:41:22","0.000036000","44","TCP","2","502","36.234348000","1726620082.768806000","57057  >  mbap(502) [ACK] Seq=217 Ack=199 Win=2619392 Len=0"
"98","21:41:24","1.994412000","56","Modbus/TCP","2","502","38.228760000","1726620084.763218000","   Query: Trans:    19; Unit:   3, Func:   4: Read Input Registers"
"99","21:41:24","0.000044000","44","TCP","2","57057","38.228804000","1726620084.763262000","mbap(502)  >  57057 [ACK] Seq=199 Ack=229 Win=2619392 Len=0"
"100","21:41:24","0.012676000","55","Modbus/TCP","2","57057","38.241480000","1726620084.775938000","Response: Trans:    19; Unit:   3, Func:   4: Read Input Registers"
"101","21:41:24","0.000062000","44","TCP","2","502","38.241542000","1726620084.776000000","57057  >  mbap(502) [ACK] Seq=229 Ack=210 Win=2619392 Len=0"
"102","21:41:26","1.995575000","56","Modbus/TCP","2","502","40.237117000","1726620086.771575000","   Query: Trans:    20; Unit:   3, Func:   4: Read Input Registers"
"103","21:41:26","0.000085000","44","TCP","2","57057","40.237202000","1726620086.771660000","mbap(502)  >  57057 [ACK] Seq=210 Ack=241 Win=2619392 Len=0"
"104","21:41:26","0.014813000","55","Modbus/TCP","2","57057","40.252015000","1726620086.786473000","Response: Trans:    20; Unit:   3, Func:   4: Read Input Registers"
"105","21:41:26","0.000132000","44","TCP","2","502","40.252147000","1726620086.786605000","57057  >  mbap(502) [ACK] Seq=241 Ack=221 Win=2619392 Len=0"
"106","21:41:28","1.990652000","56","Modbus/TCP","2","502","42.242799000","1726620088.777257000","   Query: Trans:    21; Unit:   3, Func:   4: Read Input Registers"
"107","21:41:28","0.000028000","44","TCP","2","57057","42.242827000","1726620088.777285000","mbap(502)  >  57057 [ACK] Seq=221 Ack=253 Win=2619392 Len=0"
"108","21:41:28","0.017644000","55","Modbus/TCP","2","57057","42.260471000","1726620088.794929000","Response: Trans:    21; Unit:   3, Func:   4: Read Input Registers"
"109","21:41:28","0.000067000","44","TCP","2","502","42.260538000","1726620088.794996000","57057  >  mbap(502) [ACK] Seq=253 Ack=232 Win=2619392 Len=0"
"110","21:41:30","1.994454000","56","Modbus/TCP","2","502","44.254992000","1726620090.789450000","   Query: Trans:    22; Unit:   3, Func:   4: Read Input Registers"
"111","21:41:30","0.000038000","44","TCP","2","57057","44.255030000","1726620090.789488000","mbap(502)  >  57057 [ACK] Seq=232 Ack=265 Win=2619392 Len=0"
"112","21:41:30","0.008322000","55","Modbus/TCP","2","57057","44.263352000","1726620090.797810000","Response: Trans:    22; Unit:   3, Func:   4: Read Input Registers"
"113","21:41:30","0.000061000","44","TCP","2","502","44.263413000","1726620090.797871000","57057  >  mbap(502) [ACK] Seq=265 Ack=243 Win=2619392 Len=0"
"114","21:41:32","2.003310000","56","Modbus/TCP","2","502","46.266723000","1726620092.801181000","   Query: Trans:    23; Unit:   3, Func:   4: Read Input Registers"
"115","21:41:32","0.000044000","44","TCP","2","57057","46.266767000","1726620092.801225000","mbap(502)  >  57057 [ACK] Seq=243 Ack=277 Win=2619392 Len=0"
"116","21:41:32","0.005578000","55","Modbus/TCP","2","57057","46.272345000","1726620092.806803000","Response: Trans:    23; Unit:   3, Func:   4: Read Input Registers"
"117","21:41:32","0.000049000","44","TCP","2","502","46.272394000","1726620092.806852000","57057  >  mbap(502) [ACK] Seq=277 Ack=254 Win=2619392 Len=0"
"118","21:41:34","2.037894000","56","Modbus/TCP","2","502","48.310288000","1726620094.844746000","   Query: Trans:    24; Unit:   3, Func:   4: Read Input Registers"
"119","21:41:34","0.000044000","44","TCP","2","57057","48.310332000","1726620094.844790000","mbap(502)  >  57057 [ACK] Seq=254 Ack=289 Win=2619392 Len=0"
"120","21:41:34","0.005761000","55","Modbus/TCP","2","57057","48.316093000","1726620094.850551000","Response: Trans:    24; Unit:   3, Func:   4: Read Input Registers"
"121","21:41:34","0.000089000","44","TCP","2","502","48.316182000","1726620094.850640000","57057  >  mbap(502) [ACK] Seq=289 Ack=265 Win=2619392 Len=0"
"122","21:41:36","1.967011000","56","Modbus/TCP","2","502","50.283193000","1726620096.817651000","   Query: Trans:    25; Unit:   3, Func:   4: Read Input Registers"
"123","21:41:36","0.000049000","44","TCP","2","57057","50.283242000","1726620096.817700000","mbap(502)  >  57057 [ACK] Seq=265 Ack=301 Win=2619392 Len=0"
"124","21:41:36","0.019735000","55","Modbus/TCP","2","57057","50.302977000","1726620096.837435000","Response: Trans:    25; Unit:   3, Func:   4: Read Input Registers"
"125","21:41:36","0.000043000","44","TCP","2","502","50.303020000","1726620096.837478000","57057  >  mbap(502) [ACK] Seq=301 Ack=276 Win=2619392 Len=0"
"126","21:41:38","1.974433000","56","Modbus/TCP","2","502","52.277453000","1726620098.811911000","   Query: Trans:    26; Unit:   3, Func:   4: Read Input Registers"
"127","21:41:38","0.000075000","44","TCP","2","57057","52.277528000","1726620098.811986000","mbap(502)  >  57057 [ACK] Seq=276 Ack=313 Win=2619392 Len=0"
"128","21:41:38","0.012509000","55","Modbus/TCP","2","57057","52.290037000","1726620098.824495000","Response: Trans:    26; Unit:   3, Func:   4: Read Input Registers"
"129","21:41:38","0.000050000","44","TCP","2","502","52.290087000","1726620098.824545000","57057  >  mbap(502) [ACK] Seq=313 Ack=287 Win=2619392 Len=0"
"130","21:41:40","2.008970000","56","Modbus/TCP","2","502","54.299057000","1726620100.833515000","   Query: Trans:    27; Unit:   3, Func:   4: Read Input Registers"
"131","21:41:40","0.000100000","44","TCP","2","57057","54.299157000","1726620100.833615000","mbap(502)  >  57057 [ACK] Seq=287 Ack=325 Win=2619392 Len=0"
"132","21:41:40","0.014954000","55","Modbus/TCP","2","57057","54.314111000","1726620100.848569000","Response: Trans:    27; Unit:   3, Func:   4: Read Input Registers"
"133","21:41:40","0.000043000","44","TCP","2","502","54.314154000","1726620100.848612000","57057  >  mbap(502) [ACK] Seq=325 Ack=298 Win=2619392 Len=0"
"134","21:41:42","1.984424000","56","Modbus/TCP","2","502","56.298578000","1726620102.833036000","   Query: Trans:    28; Unit:   3, Func:   4: Read Input Registers"
"135","21:41:42","0.000067000","44","TCP","2","57057","56.298645000","1726620102.833103000","mbap(502)  >  57057 [ACK] Seq=298 Ack=337 Win=2619392 Len=0"
"136","21:41:42","0.002635000","55","Modbus/TCP","2","57057","56.301280000","1726620102.835738000","Response: Trans:    28; Unit:   3, Func:   4: Read Input Registers"
"137","21:41:42","0.000081000","44","TCP","2","502","56.301361000","1726620102.835819000","57057  >  mbap(502) [ACK] Seq=337 Ack=309 Win=2619392 Len=0"
"138","21:41:44","2.012135000","56","Modbus/TCP","2","502","58.313496000","1726620104.847954000","   Query: Trans:    29; Unit:   3, Func:   4: Read Input Registers"
"139","21:41:44","0.000072000","44","TCP","2","57057","58.313568000","1726620104.848026000","mbap(502)  >  57057 [ACK] Seq=309 Ack=349 Win=2619392 Len=0"
"140","21:41:44","0.014599000","55","Modbus/TCP","2","57057","58.328167000","1726620104.862625000","Response: Trans:    29; Unit:   3, Func:   4: Read Input Registers"
"141","21:41:44","0.000044000","44","TCP","2","502","58.328211000","1726620104.862669000","57057  >  mbap(502) [ACK] Seq=349 Ack=320 Win=2619392 Len=0"
"142","21:41:46","1.994410000","56","Modbus/TCP","2","502","60.322621000","1726620106.857079000","   Query: Trans:    30; Unit:   3, Func:   4: Read Input Registers"
"143","21:41:46","0.000049000","44","TCP","2","57057","60.322670000","1726620106.857128000","mbap(502)  >  57057 [ACK] Seq=320 Ack=361 Win=2619392 Len=0"
"144","21:41:46","0.018978000","55","Modbus/TCP","2","57057","60.341648000","1726620106.876106000","Response: Trans:    30; Unit:   3, Func:   4: Read Input Registers"
"145","21:41:46","0.000020000","44","TCP","2","502","60.341668000","1726620106.876126000","57057  >  mbap(502) [ACK] Seq=361 Ack=331 Win=2619392 Len=0"
"146","21:41:48","1.988326000","56","Modbus/TCP","2","502","62.329994000","1726620108.864452000","   Query: Trans:    31; Unit:   3, Func:   4: Read Input Registers"
"147","21:41:48","0.000032000","44","TCP","2","57057","62.330026000","1726620108.864484000","mbap(502)  >  57057 [ACK] Seq=331 Ack=373 Win=2619392 Len=0"
"148","21:41:48","0.019673000","55","Modbus/TCP","2","57057","62.349699000","1726620108.884157000","Response: Trans:    31; Unit:   3, Func:   4: Read Input Registers"
"149","21:41:48","0.000072000","44","TCP","2","502","62.349771000","1726620108.884229000","57057  >  mbap(502) [ACK] Seq=373 Ack=342 Win=2619392 Len=0"
"150","21:41:50","1.984333000","56","Modbus/TCP","2","502","64.334104000","1726620110.868562000","   Query: Trans:    32; Unit:   3, Func:   4: Read Input Registers"
"151","21:41:50","0.000033000","44","TCP","2","57057","64.334137000","1726620110.868595000","mbap(502)  >  57057 [ACK] Seq=342 Ack=385 Win=2619392 Len=0"
"152","21:41:50","0.019647000","55","Modbus/TCP","2","57057","64.353784000","1726620110.888242000","Response: Trans:    32; Unit:   3, Func:   4: Read Input Registers"
"153","21:41:50","0.000052000","44","TCP","2","502","64.353836000","1726620110.888294000","57057  >  mbap(502) [ACK] Seq=385 Ack=353 Win=2619392 Len=0"
"154","21:41:52","1.992787000","56","Modbus/TCP","2","502","66.346623000","1726620112.881081000","   Query: Trans:    33; Unit:   3, Func:   4: Read Input Registers"
"155","21:41:52","0.000043000","44","TCP","2","57057","66.346666000","1726620112.881124000","mbap(502)  >  57057 [ACK] Seq=353 Ack=397 Win=2619392 Len=0"
"156","21:41:52","0.018732000","55","Modbus/TCP","2","57057","66.365398000","1726620112.899856000","Response: Trans:    33; Unit:   3, Func:   4: Read Input Registers"
"157","21:41:52","0.000033000","44","TCP","2","502","66.365431000","1726620112.899889000","57057  >  mbap(502) [ACK] Seq=397 Ack=364 Win=2619392 Len=0"
"158","21:41:54","2.080254000","56","Modbus/TCP","2","502","68.445685000","1726620114.980143000","   Query: Trans:    34; Unit:   3, Func:   4: Read Input Registers"
"159","21:41:54","0.000031000","44","TCP","2","57057","68.445716000","1726620114.980174000","mbap(502)  >  57057 [ACK] Seq=364 Ack=409 Win=2619392 Len=0"
"160","21:41:54","0.006244000","55","Modbus/TCP","2","57057","68.451960000","1726620114.986418000","Response: Trans:    34; Unit:   3, Func:   4: Read Input Registers"
"161","21:41:54","0.000043000","44","TCP","2","502","68.452003000","1726620114.986461000","57057  >  mbap(502) [ACK] Seq=409 Ack=375 Win=2619392 Len=0"
"162","21:41:56","2.007331000","56","Modbus/TCP","2","502","70.459334000","1726620116.993792000","   Query: Trans:    35; Unit:   3, Func:   4: Read Input Registers"
"163","21:41:56","0.000053000","44","TCP","2","57057","70.459387000","1726620116.993845000","mbap(502)  >  57057 [ACK] Seq=375 Ack=421 Win=2619392 Len=0"
"164","21:41:57","0.013151000","55","Modbus/TCP","2","57057","70.472538000","1726620117.006996000","Response: Trans:    35; Unit:   3, Func:   4: Read Input Registers"
"165","21:41:57","0.000042000","44","TCP","2","502","70.472580000","1726620117.007038000","57057  >  mbap(502) [ACK] Seq=421 Ack=386 Win=2619392 Len=0"
"166","21:41:59","1.994138000","56","Modbus/TCP","2","502","72.466718000","1726620119.001176000","   Query: Trans:    36; Unit:   3, Func:   4: Read Input Registers"
"167","21:41:59","0.000099000","44","TCP","2","57057","72.466817000","1726620119.001275000","mbap(502)  >  57057 [ACK] Seq=386 Ack=433 Win=2619136 Len=0"
"168","21:41:59","0.017425000","55","Modbus/TCP","2","57057","72.484242000","1726620119.018700000","Response: Trans:    36; Unit:   3, Func:   4: Read Input Registers"
"169","21:41:59","0.000046000","44","TCP","2","502","72.484288000","1726620119.018746000","57057  >  mbap(502) [ACK] Seq=433 Ack=397 Win=2619392 Len=0"
"170","21:42:01","1.991247000","56","Modbus/TCP","2","502","74.475535000","1726620121.009993000","   Query: Trans:    37; Unit:   3, Func:   4: Read Input Registers"
"171","21:42:01","0.000049000","44","TCP","2","57057","74.475584000","1726620121.010042000","mbap(502)  >  57057 [ACK] Seq=397 Ack=445 Win=2619136 Len=0"
"172","21:42:01","0.012090000","55","Modbus/TCP","2","57057","74.487674000","1726620121.022132000","Response: Trans:    37; Unit:   3, Func:   4: Read Input Registers"
"173","21:42:01","0.000043000","44","TCP","2","502","74.487717000","1726620121.022175000","57057  >  mbap(502) [ACK] Seq=445 Ack=408 Win=2619392 Len=0"
"174","21:42:03","2.004355000","56","Modbus/TCP","2","502","76.492072000","1726620123.026530000","   Query: Trans:    38; Unit:   3, Func:   4: Read Input Registers"
"175","21:42:03","0.000149000","44","TCP","2","57057","76.492221000","1726620123.026679000","mbap(502)  >  57057 [ACK] Seq=408 Ack=457 Win=2619136 Len=0"
"176","21:42:03","0.018000000","55","Modbus/TCP","2","57057","76.510221000","1726620123.044679000","Response: Trans:    38; Unit:   3, Func:   4: Read Input Registers"
"177","21:42:03","0.000052000","44","TCP","2","502","76.510273000","1726620123.044731000","57057  >  mbap(502) [ACK] Seq=457 Ack=419 Win=2619136 Len=0"
"178","21:42:05","1.996046000","56","Modbus/TCP","2","502","78.506319000","1726620125.040777000","   Query: Trans:    39; Unit:   3, Func:   4: Read Input Registers"
"179","21:42:05","0.000098000","44","TCP","2","57057","78.506417000","1726620125.040875000","mbap(502)  >  57057 [ACK] Seq=419 Ack=469 Win=2619136 Len=0"
"180","21:42:05","0.009357000","55","Modbus/TCP","2","57057","78.515774000","1726620125.050232000","Response: Trans:    39; Unit:   3, Func:   4: Read Input Registers"
"181","21:42:05","0.000043000","44","TCP","2","502","78.515817000","1726620125.050275000","57057  >  mbap(502) [ACK] Seq=469 Ack=430 Win=2619136 Len=0"
"182","21:42:07","2.001011000","56","Modbus/TCP","2","502","80.516828000","1726620127.051286000","   Query: Trans:    40; Unit:   3, Func:   4: Read Input Registers"
"183","21:42:07","0.000043000","44","TCP","2","57057","80.516871000","1726620127.051329000","mbap(502)  >  57057 [ACK] Seq=430 Ack=481 Win=2619136 Len=0"
"184","21:42:07","0.002483000","55","Modbus/TCP","2","57057","80.519354000","1726620127.053812000","Response: Trans:    40; Unit:   3, Func:   4: Read Input Registers"
"185","21:42:07","0.000043000","44","TCP","2","502","80.519397000","1726620127.053855000","57057  >  mbap(502) [ACK] Seq=481 Ack=441 Win=2619136 Len=0"
"186","21:42:09","2.008581000","56","Modbus/TCP","2","502","82.527978000","1726620129.062436000","   Query: Trans:    41; Unit:   3, Func:   4: Read Input Registers"
"187","21:42:09","0.000055000","44","TCP","2","57057","82.528033000","1726620129.062491000","mbap(502)  >  57057 [ACK] Seq=441 Ack=493 Win=2619136 Len=0"
"188","21:42:09","0.019258000","55","Modbus/TCP","2","57057","82.547291000","1726620129.081749000","Response: Trans:    41; Unit:   3, Func:   4: Read Input Registers"
"189","21:42:09","0.000035000","44","TCP","2","502","82.547326000","1726620129.081784000","57057  >  mbap(502) [ACK] Seq=493 Ack=452 Win=2619136 Len=0"
"190","21:42:11","1.995683000","56","Modbus/TCP","2","502","84.543009000","1726620131.077467000","   Query: Trans:    42; Unit:   3, Func:   4: Read Input Registers"
"191","21:42:11","0.000030000","44","TCP","2","57057","84.543039000","1726620131.077497000","mbap(502)  >  57057 [ACK] Seq=452 Ack=505 Win=2619136 Len=0"
"192","21:42:11","0.007486000","55","Modbus/TCP","2","57057","84.550525000","1726620131.084983000","Response: Trans:    42; Unit:   3, Func:   4: Read Input Registers"
"193","21:42:11","0.000035000","44","TCP","2","502","84.550560000","1726620131.085018000","57057  >  mbap(502) [ACK] Seq=505 Ack=463 Win=2619136 Len=0"
"194","21:42:13","1.997086000","56","Modbus/TCP","2","502","86.547646000","1726620133.082104000","   Query: Trans:    43; Unit:   3, Func:   4: Read Input Registers"
"195","21:42:13","0.000034000","44","TCP","2","57057","86.547680000","1726620133.082138000","mbap(502)  >  57057 [ACK] Seq=463 Ack=517 Win=2619136 Len=0"
"196","21:42:13","0.009623000","55","Modbus/TCP","2","57057","86.557303000","1726620133.091761000","Response: Trans:    43; Unit:   3, Func:   4: Read Input Registers"
"197","21:42:13","0.000037000","44","TCP","2","502","86.557340000","1726620133.091798000","57057  >  mbap(502) [ACK] Seq=517 Ack=474 Win=2619136 Len=0"
"198","21:42:15","1.980593000","56","Modbus/TCP","2","502","88.537933000","1726620135.072391000","   Query: Trans:    44; Unit:   3, Func:   4: Read Input Registers"
"199","21:42:15","0.000044000","44","TCP","2","57057","88.537977000","1726620135.072435000","mbap(502)  >  57057 [ACK] Seq=474 Ack=529 Win=2619136 Len=0"
"200","21:42:15","0.006414000","55","Modbus/TCP","2","57057","88.544391000","1726620135.078849000","Response: Trans:    44; Unit:   3, Func:   4: Read Input Registers"
"201","21:42:15","0.000049000","44","TCP","2","502","88.544440000","1726620135.078898000","57057  >  mbap(502) [ACK] Seq=529 Ack=485 Win=2619136 Len=0"
"202","21:42:17","2.020866000","56","Modbus/TCP","2","502","90.565306000","1726620137.099764000","   Query: Trans:    45; Unit:   3, Func:   4: Read Input Registers"
"203","21:42:17","0.000039000","44","TCP","2","57057","90.565345000","1726620137.099803000","mbap(502)  >  57057 [ACK] Seq=485 Ack=541 Win=2619136 Len=0"
"204","21:42:17","0.010320000","55","Modbus/TCP","2","57057","90.575665000","1726620137.110123000","Response: Trans:    45; Unit:   3, Func:   4: Read Input Registers"
"205","21:42:17","0.000036000","44","TCP","2","502","90.575701000","1726620137.110159000","57057  >  mbap(502) [ACK] Seq=541 Ack=496 Win=2619136 Len=0"
"206","21:42:19","1.995897000","56","Modbus/TCP","2","502","92.571598000","1726620139.106056000","   Query: Trans:    46; Unit:   3, Func:   4: Read Input Registers"
"207","21:42:19","0.000049000","44","TCP","2","57057","92.571647000","1726620139.106105000","mbap(502)  >  57057 [ACK] Seq=496 Ack=553 Win=2619136 Len=0"
"208","21:42:19","0.009783000","55","Modbus/TCP","2","57057","92.581430000","1726620139.115888000","Response: Trans:    46; Unit:   3, Func:   4: Read Input Registers"
"209","21:42:19","0.000037000","44","TCP","2","502","92.581467000","1726620139.115925000","57057  >  mbap(502) [ACK] Seq=553 Ack=507 Win=2619136 Len=0"
"210","21:42:21","1.999135000","56","Modbus/TCP","2","502","94.580602000","1726620141.115060000","   Query: Trans:    47; Unit:   3, Func:   4: Read Input Registers"
"211","21:42:21","0.000033000","44","TCP","2","57057","94.580635000","1726620141.115093000","mbap(502)  >  57057 [ACK] Seq=507 Ack=565 Win=2619136 Len=0"
"212","21:42:21","0.006844000","55","Modbus/TCP","2","57057","94.587479000","1726620141.121937000","Response: Trans:    47; Unit:   3, Func:   4: Read Input Registers"
"213","21:42:21","0.000043000","44","TCP","2","502","94.587522000","1726620141.121980000","57057  >  mbap(502) [ACK] Seq=565 Ack=518 Win=2619136 Len=0"
"214","21:42:23","2.017110000","56","Modbus/TCP","2","502","96.604632000","1726620143.139090000","   Query: Trans:    48; Unit:   3, Func:   4: Read Input Registers"
"215","21:42:23","0.000061000","44","TCP","2","57057","96.604693000","1726620143.139151000","mbap(502)  >  57057 [ACK] Seq=518 Ack=577 Win=2619136 Len=0"
"216","21:42:23","0.012765000","55","Modbus/TCP","2","57057","96.617458000","1726620143.151916000","Response: Trans:    48; Unit:   3, Func:   4: Read Input Registers"
"217","21:42:23","0.000049000","44","TCP","2","502","96.617507000","1726620143.151965000","57057  >  mbap(502) [ACK] Seq=577 Ack=529 Win=2619136 Len=0"
"218","21:42:25","1.952443000","44","TCP","2","502","98.569950000","1726620145.104408000","57057  >  mbap(502) [FIN, ACK] Seq=577 Ack=529 Win=2619136 Len=0"
"219","21:42:25","0.000078000","44","TCP","2","57057","98.570028000","1726620145.104486000","mbap(502)  >  57057 [ACK] Seq=529 Ack=578 Win=2619136 Len=0"
"220","21:42:25","0.012197000","44","TCP","2","57057","98.582225000","1726620145.116683000","mbap(502)  >  57057 [FIN, ACK] Seq=529 Ack=578 Win=2619136 Len=0"
"221","21:42:25","0.000099000","44","TCP","2","502","98.582324000","1726620145.116782000","57057  >  mbap(502) [ACK] Seq=578 Ack=530 Win=2619136 Len=0"
"222","21:42:26","0.000000000","56","TCP","3","502","0.000000000","1726620146.631210000","57120  >  mbap(502) [SYN] Seq=0 Win=65535 Len=0 MSS=65495 WS=256 SACK_PERM"
"223","21:42:26","0.000136000","56","TCP","3","57120","0.000136000","1726620146.631346000","mbap(502)  >  57120 [SYN, ACK] Seq=0 Ack=1 Win=65535 Len=0 MSS=65495 WS=256 SACK_PERM"
"224","21:42:26","0.000069000","44","TCP","3","502","0.000205000","1726620146.631415000","57120  >  mbap(502) [ACK] Seq=1 Ack=1 Win=2619648 Len=0"
"225","21:42:28","2.339403000","56","Modbus/TCP","3","502","2.339608000","1726620148.970818000","   Query: Trans:     1; Unit:   3, Func:   4: Read Input Registers"
"226","21:42:28","0.000088000","44","TCP","3","57120","2.339696000","1726620148.970906000","mbap(502)  >  57120 [ACK] Seq=1 Ack=13 Win=2619648 Len=0"
"227","21:42:28","0.006609000","55","Modbus/TCP","3","57120","2.346305000","1726620148.977515000","Response: Trans:     1; Unit:   3, Func:   4: Read Input Registers"
"228","21:42:28","0.000042000","44","TCP","3","502","2.346347000","1726620148.977557000","57120  >  mbap(502) [ACK] Seq=13 Ack=12 Win=2619648 Len=0"
"229","21:42:30","1.993382000","56","Modbus/TCP","3","502","4.339729000","1726620150.970939000","   Query: Trans:     2; Unit:   3, Func:   4: Read Input Registers"
"230","21:42:30","0.000082000","44","TCP","3","57120","4.339811000","1726620150.971021000","mbap(502)  >  57120 [ACK] Seq=12 Ack=25 Win=2619648 Len=0"
"231","21:42:30","0.006936000","55","Modbus/TCP","3","57120","4.346747000","1726620150.977957000","Response: Trans:     2; Unit:   3, Func:   4: Read Input Registers"
"232","21:42:30","0.000106000","44","TCP","3","502","4.346853000","1726620150.978063000","57120  >  mbap(502) [ACK] Seq=25 Ack=23 Win=2619648 Len=0"
"233","21:42:32","2.002751000","56","Modbus/TCP","3","502","6.349604000","1726620152.980814000","   Query: Trans:     3; Unit:   3, Func:   4: Read Input Registers"
"234","21:42:32","0.000047000","44","TCP","3","57120","6.349651000","1726620152.980861000","mbap(502)  >  57120 [ACK] Seq=23 Ack=37 Win=2619648 Len=0"
"235","21:42:32","0.016676000","55","Modbus/TCP","3","57120","6.366327000","1726620152.997537000","Response: Trans:     3; Unit:   3, Func:   4: Read Input Registers"
"236","21:42:32","0.000044000","44","TCP","3","502","6.366371000","1726620152.997581000","57120  >  mbap(502) [ACK] Seq=37 Ack=34 Win=2619648 Len=0"
"237","21:42:34","1.990351000","56","Modbus/TCP","3","502","8.356722000","1726620154.987932000","   Query: Trans:     4; Unit:   3, Func:   4: Read Input Registers"
"238","21:42:34","0.000087000","44","TCP","3","57120","8.356809000","1726620154.988019000","mbap(502)  >  57120 [ACK] Seq=34 Ack=49 Win=2619648 Len=0"
"239","21:42:35","0.014556000","55","Modbus/TCP","3","57120","8.371365000","1726620155.002575000","Response: Trans:     4; Unit:   3, Func:   4: Read Input Registers"
"240","21:42:35","0.000046000","44","TCP","3","502","8.371411000","1726620155.002621000","57120  >  mbap(502) [ACK] Seq=49 Ack=45 Win=2619648 Len=0"
"241","21:42:36","1.972815000","56","Modbus/TCP","3","502","10.344226000","1726620156.975436000","   Query: Trans:     5; Unit:   3, Func:   4: Read Input Registers"
"242","21:42:36","0.000031000","44","TCP","3","57120","10.344257000","1726620156.975467000","mbap(502)  >  57120 [ACK] Seq=45 Ack=61 Win=2619648 Len=0"
"243","21:42:36","0.015168000","55","Modbus/TCP","3","57120","10.359425000","1726620156.990635000","Response: Trans:     5; Unit:   3, Func:   4: Read Input Registers"
"244","21:42:36","0.000058000","44","TCP","3","502","10.359483000","1726620156.990693000","57120  >  mbap(502) [ACK] Seq=61 Ack=56 Win=2619648 Len=0"
"245","21:42:38","2.007934000","56","Modbus/TCP","3","502","12.367417000","1726620158.998627000","   Query: Trans:     6; Unit:   3, Func:   4: Read Input Registers"
"246","21:42:38","0.000039000","44","TCP","3","57120","12.367456000","1726620158.998666000","mbap(502)  >  57120 [ACK] Seq=56 Ack=73 Win=2619648 Len=0"
"247","21:42:39","0.017898000","55","Modbus/TCP","3","57120","12.385354000","1726620159.016564000","Response: Trans:     6; Unit:   3, Func:   4: Read Input Registers"
"248","21:42:39","0.000045000","44","TCP","3","502","12.385399000","1726620159.016609000","57120  >  mbap(502) [ACK] Seq=73 Ack=67 Win=2619648 Len=0"
"249","21:42:41","1.983817000","56","Modbus/TCP","3","502","14.369216000","1726620161.000426000","   Query: Trans:     7; Unit:   3, Func:   4: Read Input Registers"
"250","21:42:41","0.000094000","44","TCP","3","57120","14.369310000","1726620161.000520000","mbap(502)  >  57120 [ACK] Seq=67 Ack=85 Win=2619648 Len=0"
